<?xml version="1.0" encoding="UTF-8"?>
<!-- <!DOCTYPE udvar SYSTEM "macskakBPWTW0.dtd">  -->
<macskak	xmlns:xsi="http://www.w3.org/2001/XMLSchema-instance"
			xsi:noNamespaceSchemaLocation="macskakBPWTW0.xsd">

	<macska id="1">
		<nev>nev1</nev>
		<kor>3</kor>
		<fajta>fajta1</fajta>
	</macska>
	<macska id="2">
		<nev>nev2</nev>
		<kor>4</kor>
		<fajta>fajta2</fajta>
	</macska>
	<macska id="3">
		<nev>nev3</nev>
		<kor>3</kor>
		<fajta>fajta3</fajta>
	</macska>

</macskak>